{
  "schema_version": 1,
  "workflow": "subject",
  "source": {
    "key": "subjects",
    "label": "Subjects"
  },
  "strapi": {
    "collection_type": "subject",
    "display_name": "Subjects"
  },
  "records": [
    {
      "subject_code": "SUB001",
      "legacy_code": null,
      "is_active": true,
      "sort_order": 1,
      "category_code": "CAT008",
      "desired_status": "published",
      "name_en": "Swasthya Rahasya",
      "description_en": "Swasthya Rahasya",
      "name_hi_IN": "स्वास्थ्य रहस्य",
      "description_hi_IN": "स्वास्थ्य रहस्य",
      "from_date": "2005-11-04",
      "to_date": "2006-01-22",
      "prabodhan_count": 24
    },
    {
      "subject_code": "SUB002",
      "legacy_code": null,
      "is_active": true,
      "sort_order": 2,
      "category_code": "CAT001",
      "desired_status": "published",
      "name_en": "Shrimad Bhagvad Geeta",
      "description_en": "Shrimad Bhagvad Geeta",
      "name_hi_IN": "श्रीमद् भगवद्गीता",
      "description_hi_IN": "श्रीमद् भगवद्गीता",
      "from_date": "2006-01-20",
      "to_date": "2006-06-23",
      "prabodhan_count": 21
    },
    {
      "subject_code": "SUB003",
      "legacy_code": null,
      "is_active": true,
      "sort_order": 3,
      "category_code": "CAT002",
      "desired_status": "published",
      "name_en": "Shri Guru Geeta",
      "description_en": "Shri Guru Geeta",
      "name_hi_IN": "श्री गुरुगीता",
      "description_hi_IN": "श्री गुरुगीता",
      "from_date": "2006-02-02",
      "to_date": "2006-06-22",
      "prabodhan_count": 19
    },
    {
      "subject_code": "SUB004",
      "legacy_code": null,
      "is_active": true,
      "sort_order": 4,
      "category_code": "CAT010",
      "desired_status": "published",
      "name_en": "Sahaj Sadhana",
      "description_en": "Sahaj Sadhana",
      "name_hi_IN": "सहज साधना",
      "description_hi_IN": "सहज साधना",
      "from_date": "2006-03-04",
      "to_date": "2006-05-01",
      "prabodhan_count": 34
    },
    {
      "subject_code": "SUB005",
      "legacy_code": null,
      "is_active": true,
      "sort_order": 5,
      "category_code": "CAT008",
      "desired_status": "published",
      "name_en": "Yasha Prapti",
      "description_en": "Yasha Prapti",
      "name_hi_IN": "यश प्राप्ती",
      "description_hi_IN": "यश प्राप्ती",
      "from_date": "2006-05-02",
      "to_date": "2006-06-14",
      "prabodhan_count": 31
    },
    {
      "subject_code": "SUB006",
      "legacy_code": null,
      "is_active": true,
      "sort_order": 6,
      "category_code": "CAT005",
      "desired_status": "published",
      "name_en": "Manavata",
      "description_en": "Manavata",
      "name_hi_IN": "मानवता",
      "description_hi_IN": "मानवता",
      "from_date": "2006-06-17",
      "to_date": "2006-10-03",
      "prabodhan_count": 72
    },
    {
      "subject_code": "SUB007",
      "legacy_code": null,
      "is_active": true,
      "sort_order": 7,
      "category_code": "CAT003",
      "desired_status": "published",
      "name_en": "Shri Guru Charitra",
      "description_en": "Shri Guru Charitra",
      "name_hi_IN": "श्री गुरुचरित्र",
      "description_hi_IN": "श्री गुरुचरित्र",
      "from_date": "2006-06-29",
      "to_date": "2007-07-19",
      "prabodhan_count": 56
    },
    {
      "subject_code": "SUB008",
      "legacy_code": null,
      "is_active": true,
      "sort_order": 8,
      "category_code": "CAT004",
      "desired_status": "published",
      "name_en": "Gyanadhishthit Aacharan",
      "description_en": "Gyanadhishthit Aacharan",
      "name_hi_IN": "ज्ञानाधिष्ठित आचरण",
      "description_hi_IN": "ज्ञानाधिष्ठित आचरण",
      "from_date": "2006-06-30",
      "to_date": "2006-09-29",
      "prabodhan_count": 11
    },
    {
      "subject_code": "SUB009",
      "legacy_code": null,
      "is_active": true,
      "sort_order": 9,
      "category_code": "CAT009",
      "desired_status": "published",
      "name_en": "Samasya Nirakaran",
      "description_en": "Samasya Nirakaran",
      "name_hi_IN": "समस्या निराकरण",
      "description_hi_IN": "समस्या निराकरण",
      "from_date": "2006-10-04",
      "to_date": "2006-11-25",
      "prabodhan_count": 37
    },
    {
      "subject_code": "SUB010",
      "legacy_code": null,
      "is_active": true,
      "sort_order": 10,
      "category_code": "CAT009",
      "desired_status": "published",
      "name_en": "Ishavasyopanishad",
      "description_en": "Ishavasyopanishad",
      "name_hi_IN": "ईशावस्योपनिषद",
      "description_hi_IN": "ईशावस्योपनिषद",
      "from_date": "2006-10-06",
      "to_date": "2007-01-12",
      "prabodhan_count": 15
    },
    {
      "subject_code": "SUB011",
      "legacy_code": null,
      "is_active": true,
      "sort_order": 11,
      "category_code": "CAT009",
      "desired_status": "published",
      "name_en": "Itareyopanishad",
      "description_en": "Itareyopanishad",
      "name_hi_IN": "ऐतरेयोपनिषद",
      "description_hi_IN": "ऐतरेयोपनिषद",
      "from_date": "2007-01-19",
      "to_date": "2007-03-23",
      "prabodhan_count": 10
    },
    {
      "subject_code": "SUB012",
      "legacy_code": null,
      "is_active": true,
      "sort_order": 12,
      "category_code": "CAT009",
      "desired_status": "published",
      "name_en": "Taitareyopanishad",
      "description_en": "Taitareyopanishad",
      "name_hi_IN": "तैतरेयोपनिषद",
      "description_hi_IN": "तैतरेयोपनिषद",
      "from_date": "2007-03-30",
      "to_date": "2008-02-01",
      "prabodhan_count": 45
    },
    {
      "subject_code": "SUB013",
      "legacy_code": null,
      "is_active": true,
      "sort_order": 13,
      "category_code": "CAT009",
      "desired_status": "published",
      "name_en": "Kathopanishad",
      "description_en": "Kathopanishad",
      "name_hi_IN": "कठोपनिषद",
      "description_hi_IN": "कठोपनिषद",
      "from_date": "2008-02-08",
      "to_date": "2008-07-04",
      "prabodhan_count": 22
    },
    {
      "subject_code": "SUB014",
      "legacy_code": null,
      "is_active": true,
      "sort_order": 14,
      "category_code": "CAT009",
      "desired_status": "published",
      "name_en": "Kenopanishad",
      "description_en": "Kenopanishad",
      "name_hi_IN": "केणोपनिशद",
      "description_hi_IN": "केणोपनिशद",
      "from_date": "2008-07-11",
      "to_date": "2008-09-19",
      "prabodhan_count": 8
    },
    {
      "subject_code": "SUB015",
      "legacy_code": null,
      "is_active": true,
      "sort_order": 15,
      "category_code": "CAT009",
      "desired_status": "published",
      "name_en": "Mundakopanishad",
      "description_en": "Mundakopanishad",
      "name_hi_IN": "मुंडकोपनिषद",
      "description_hi_IN": "मुंडकोपनिषद",
      "from_date": "2008-09-26",
      "to_date": "2008-11-21",
      "prabodhan_count": 12
    },
    {
      "subject_code": "SUB016",
      "legacy_code": null,
      "is_active": true,
      "sort_order": 16,
      "category_code": "CAT009",
      "desired_status": "published",
      "name_en": "Shvetashvetaropanishad",
      "description_en": "Shvetashvetaropanishad",
      "name_hi_IN": "श्वेतश्वेतरोपनिषद",
      "description_hi_IN": "श्वेतश्वेतरोपनिषद",
      "from_date": "2008-11-28",
      "to_date": "2009-04-17",
      "prabodhan_count": 20
    },
    {
      "subject_code": "SUB017",
      "legacy_code": null,
      "is_active": true,
      "sort_order": 17,
      "category_code": "CAT009",
      "desired_status": "published",
      "name_en": "Mandukyopanishad",
      "description_en": "Mandukyapanishad",
      "name_hi_IN": "मांडुक्योकनिषद",
      "description_hi_IN": "मांडुक्योकनिषद",
      "from_date": "2009-04-24",
      "to_date": "2009-05-22",
      "prabodhan_count": 5
    },
    {
      "subject_code": "SUB018",
      "legacy_code": null,
      "is_active": true,
      "sort_order": 18,
      "category_code": "CAT009",
      "desired_status": "published",
      "name_en": "Prashnopanishad",
      "description_en": "Prashnopanishad",
      "name_hi_IN": "प्रश्नोपनिषद",
      "description_hi_IN": "प्रश्नोपनिषद",
      "from_date": "2009-05-29",
      "to_date": "2009-10-02",
      "prabodhan_count": 19
    },
    {
      "subject_code": "SUB019",
      "legacy_code": null,
      "is_active": true,
      "sort_order": 19,
      "category_code": "CAT009",
      "desired_status": "published",
      "name_en": "Chandogyopanishad",
      "description_en": "Ghandogyopanishad",
      "name_hi_IN": "छांदोग्योपनिषद",
      "description_hi_IN": "छांदोग्योपनिषद",
      "from_date": "2009-10-09",
      "to_date": "2011-10-21",
      "prabodhan_count": 108
    },
    {
      "subject_code": "SUB020",
      "legacy_code": null,
      "is_active": true,
      "sort_order": 20,
      "category_code": "CAT009",
      "desired_status": "published",
      "name_en": "Bruhad Aranyakopanishad",
      "description_en": "Bruhad Aranyakopanishad",
      "name_hi_IN": "बृहद् अरण्यकोपनिषद",
      "description_hi_IN": "बृहद् अरण्यकोपनिषद",
      "from_date": "2011-10-28",
      "to_date": "2015-12-17",
      "prabodhan_count": 151
    },
    {
      "subject_code": "SUB021",
      "legacy_code": null,
      "is_active": true,
      "sort_order": 21,
      "category_code": "CAT010",
      "desired_status": "published",
      "name_en": "Namasadhana Yog",
      "description_en": "Namasadhana Yog",
      "name_hi_IN": "नामसाधना योग",
      "description_hi_IN": "नामसाधना योग",
      "from_date": "2006-11-27",
      "to_date": "2007-01-15",
      "prabodhan_count": 33
    },
    {
      "subject_code": "SUB022",
      "legacy_code": null,
      "is_active": true,
      "sort_order": 22,
      "category_code": "CAT001",
      "desired_status": "published",
      "name_en": "Dharmasansthapanarthaya",
      "description_en": "Dharmasansthapanarthaya",
      "name_hi_IN": "धर्मसंस्थापनार्थाय",
      "description_hi_IN": "धर्मसंस्थापनार्थाय",
      "from_date": "2007-01-17",
      "to_date": "2007-03-31",